{
    "id": "application-policy-3",
    "algorithm": "one-after-another",
    "networkPartitions": [
        "network-partition-9",
        "network-partition-10"
    ],
    "properties": [
        {
            "name": "networkPartitionGroups",
            "value": "network-partition-9|network-partition-10"
        },
        {
            "name": "key-2",
            "value": "value-2"
        }
    ]
}
